{
  "type": "RecordOrder",
  "schemaVersion": 2,
  "messageId": "100925016375300109",
  "commandId": "100925016375300108",
  "sagaId": "100925016375300107",
  "orderId": "100925016375300106",
  "buyerId": "21380884070404102",
  "requestFingerprint": "48b6fb8c998f5faefa5c3ef28de4c1a1e4e4a4c982a5dc71626e0202cf5a340f",
  "occurredAt": "2026-10-06T12:00:00Z",
  "resultMessageId": "100925016375300110",
  "snapshot": {
    "amount": "3000.00",
    "currency": "JPY",
    "items": [
      {
        "itemPosition": 0,
        "sellerId": "11234023833608192",
        "productId": "11234023837802497",
        "quantity": 2,
        "productName": "Japanese travel mug",
        "unitPrice": "1500.00",
        "currency": "JPY"
      }
    ]
  }
}
